,Movie Name,Description,Genre,Year of Release,Watch Time,Movie Rating,Meatscore of movie,Votes,Gross (in M)
0,The Shawshank Redemption,"Over the course of several years, two convicts form a friendship, seeking consolation and, eventually, redemption through basic compassion.",Drama            ,1994,142,9.3,81        ,2699133,28.34
1,The Godfather,The aging patriarch of an organized crime dynasty in postwar New York City transfers control of his clandestine empire to his reluctant youngest son.,Crime,1972,175,9.2,100        ,1873343,134.97
2,The Dark Knight,"When the menace known as the Joker wreaks havoc and chaos on the people of Gotham, Batman must accept one of the greatest psychological and physical tests of his ability to fight injustice.",Action,2008,152,9.0,84        ,2672870,534.86
3,Schindler's List,"In German-occupied Poland during World War II, industrialist Oskar Schindler gradually becomes concerned for his Jewish workforce after witnessing their persecution by the Nazis.",Biography,1993,195,9.0,95        ,1364512,96.9
4,The Godfather Part II,"The early life and career of Vito Corleone in 1920s New York City is portrayed, while his son, Michael, expands and tightens his grip on the family crime syndicate.",Crime,1974,202,9.0,90        ,1280215,57.3
5,12 Angry Men,The jury in a New York City murder trial is frustrated by a single member whose skeptical caution forces them to more carefully consider the evidence before jumping to a hasty verdict.,Crime,1957,96,9.0,97        ,797141,4.36
6,The Lord of the Rings: The Return of the King,Gandalf and Aragorn lead the World of Men against Sauron's army to draw his gaze from Frodo and Sam as they approach Mount Doom with the One Ring.,Action,2003,201,9.0,94        ,1858754,377.85
7,Pulp Fiction,"The lives of two mob hitmen, a boxer, a gangster and his wife, and a pair of diner bandits intertwine in four tales of violence and redemption.",Crime,1994,154,8.9,94        ,2071829,107.93
8,777 Charlie,Dharma is stuck in a rut with his negative and lonely lifestyle and spends each day in the comfort of his loneliness. A pup named Charlie enters his life and gives him a new perspective towards it.,Adventure,2022,136,8.9,0,33182,0.0
9,Inception,"A thief who steals corporate secrets through the use of dream-sharing technology is given the inverse task of planting an idea into the mind of a C.E.O., but his tragic past may doom the project and his team to disaster.",Action,2010,148,8.8,74        ,2371219,292.58
10,Fight Club,An insomniac office worker and a devil-may-care soap maker form an underground fight club that evolves into much more.,Drama            ,1999,139,8.8,66        ,2144054,37.03
11,The Lord of the Rings: The Fellowship of the Ring,A meek Hobbit from the Shire and eight companions set out on a journey to destroy the powerful One Ring and save Middle-earth from the Dark Lord Sauron.,Action,2001,178,8.8,92        ,1888087,315.54
12,Forrest Gump,"The presidencies of Kennedy and Johnson, the Vietnam War, the Watergate scandal and other historical events unfold from the perspective of an Alabama man with an IQ of 75, whose only desire is to be reunited with his childhood sweetheart.",Drama,1994,142,8.8,82        ,2096359,330.25
13,"Il buono, il brutto, il cattivo",A bounty hunting scam joins two men in an uneasy alliance against a third in a race to find a fortune in gold buried in a remote cemetery.,Adventure,1966,161,8.8,90        ,766831,6.1
14,The Lord of the Rings: The Two Towers,"While Frodo and Sam edge closer to Mordor with the help of the shifty Gollum, the divided fellowship makes a stand against Sauron's new ally, Saruman, and his hordes of Isengard.",Action,2002,179,8.8,87        ,1678344,342.55
15,Jai Bhim,"When a tribal man is arrested for a case of alleged theft, his wife turns to a human-rights lawyer to help bring justice.",Crime,2021,164,8.8,0,204005,
16,Rocketry: The Nambi Effect,"Based on the life of Indian Space Research Organization scientist Nambi Narayanan, who was framed for being a spy and arrested in 1994. Though free, he continues to fight for justice against the officials who falsely implicated him.",Biography,2022,157,8.8,0,51792,0.0
17,GoodFellas,"The story of Henry Hill and his life in the mob, covering his relationship with his wife Karen Hill and his mob partners Jimmy Conway and Tommy DeVito in the Italian-American crime syndicate.",Biography,1990,145,8.7,91        ,1170776,46.84
18,The Matrix,"When a beautiful stranger leads computer hacker Neo to a forbidding underworld, he discovers the shocking truth--the life he knows is the elaborate deception of an evil cyber-intelligence.",Action,1999,136,8.7,73        ,1926233,171.48
19,One Flew Over the Cuckoo's Nest,"In the Fall of 1963, a Korean War veteran and criminal pleads insanity and is admitted to a mental institution, where he rallies up the scared patients against the tyrannical nurse.",Drama            ,1975,133,8.7,84        ,1013892,112.0
20,The Empire Strikes Back,"After the Rebels are brutally overpowered by the Empire on the ice planet Hoth, Luke Skywalker begins Jedi training with Yoda, while his friends are pursued across the galaxy by Darth Vader and bounty hunter Boba Fett.",Action,1980,124,8.7,82        ,1301120,290.48
21,Soorarai Pottru,"Nedumaaran Rajangam ""Maara"" sets out to make the common man fly and in the process takes on the world's most capital intensive industry and several enemies who stand in his way.",Action,2020,153,8.7,0,118087,0.0
22,Interstellar,A team of explorers travel through a wormhole in space in an attempt to ensure humanity's survival.,Adventure,2014,169,8.6,74        ,1855987,188.02
23,Se7en,"Two detectives, a rookie and a veteran, hunt a serial killer who uses the seven deadly sins as his motives.",Crime,1995,127,8.6,65        ,1666290,100.13
24,The Silence of the Lambs,"A young F.B.I. cadet must receive the help of an incarcerated and manipulative cannibal killer to help catch another serial killer, a madman who skins his victims.",Crime,1991,118,8.6,85        ,1443155,130.74
25,Saving Private Ryan,"Following the Normandy Landings, a group of U.S. soldiers go behind enemy lines to retrieve a paratrooper whose brothers have been killed in action.",Drama,1998,169,8.6,91        ,1401364,216.54
26,The Green Mile,"The lives of guards on Death Row are affected by one of their charges: a black man accused of child murder and rape, yet who has a mysterious gift.",Crime,1999,189,8.6,61        ,1311977,136.8
27,Star Wars,"Luke Skywalker joins forces with a Jedi Knight, a cocky pilot, a Wookiee and two droids to save the galaxy from the Empire's world-destroying battle station, while also attempting to rescue Princess Leia from the mysterious Darth Vader.",Action,1977,121,8.6,90        ,1373517,322.74
28,La vita è bella,"When an open-minded Jewish waiter and his son become victims of the Holocaust, he uses a perfect mixture of will, humor, and imagination to protect his son from the dangers around their camp.",Comedy,1997,116,8.6,59        ,700679,57.6
29,Terminator 2: Judgment Day,"A cyborg, identical to the one who failed to kill Sarah Connor, must now protect her 10-year old son John from an even more advanced and powerful cyborg.",Action,1991,137,8.6,75        ,1106970,204.84
30,Sen to Chihiro no kamikakushi,"During her family's move to the suburbs, a sullen 10-year-old girl wanders into a world ruled by gods, witches, and spirits, and where humans are changed into beasts.",Animation,2001,125,8.6,96        ,771822,10.06
31,Cidade de Deus,"In the slums of Rio, two kids' paths diverge as one struggles to become a photographer and the other a kingpin.",Crime,2002,130,8.6,79        ,761507,7.56
32,It's a Wonderful Life,An angel is sent from Heaven to help a desperately frustrated businessman by showing him what life would have been like if he had never existed.,Drama,1946,130,8.6,89        ,466235,
33,Shichinin no samurai,"Farmers from a village exploited by bandits hire a veteran samurai for protection, who gathers six other samurai to join him.",Action,1954,207,8.6,98        ,348407,0.27
34,Sita Ramam,"An orphan soldier, Lieutenant Ram's life changes, after he gets a letter from a girl named Sita. He meets her and love blossoms between them. When he comes back to his camp in Kashmir,After he gets caught in jail, he sends a letter to Sita which won't reach her.",Action,2022,163,8.6,0,55478,0.0
35,Seppuku,"When a ronin requesting seppuku at a feudal lord's palace is told of the brutal suicide of another ronin who previously visited, he reveals how their pasts are intertwined - and in doing so challenges the clan's integrity.",Action,1962,133,8.6,85        ,58816,
36,Whiplash,A promising young drummer enrolls at a cut-throat music conservatory where his dreams of greatness are mentored by an instructor who will stop at nothing to realize a student's potential.,Drama,2014,106,8.5,89        ,876162,13.09
37,Gisaengchung,Greed and class discrimination threaten the newly formed symbiotic relationship between the wealthy Park family and the destitute Kim clan.,Drama,2019,132,8.5,96        ,819986,53.37
38,Gladiator,A former Roman General sets out to exact vengeance against the corrupt emperor who murdered his family and sent him into slavery.,Action,2000,155,8.5,67        ,1511448,187.71
39,The Departed,An undercover cop and a mole in the police attempt to identify each other while infiltrating an Irish gang in South Boston.,Crime,2006,151,8.5,85        ,1334665,132.38
40,Léon,"12-year-old Mathilda is reluctantly taken in by Léon, a professional assassin, after her family is murdered. An unusual relationship forms as she becomes his protégée and learns the assassin's trade.",Action,1994,110,8.5,64        ,1170499,19.5
41,The Prestige,"After a tragic accident, two stage magicians in 1890s London engage in a battle to create the ultimate illusion while sacrificing everything they have to outwit each other.",Drama,2006,130,8.5,66        ,1343194,53.09
42,Apocalypse Now,A U.S. Army officer serving in Vietnam is tasked with assassinating a renegade Special Forces Colonel who sees himself as a god.,Drama,1979,147,8.5,94        ,672819,83.47
43,Back to the Future,"Marty McFly, a 17-year-old high school student, is accidentally sent 30 years into the past in a time-traveling DeLorean invented by his close friend, the maverick scientist Doc Brown.",Adventure,1985,116,8.5,87        ,1215929,210.61
44,Alien,The crew of a commercial spacecraft encounter a deadly lifeform after investigating an unknown transmission.,Horror,1979,117,8.5,89        ,889712,78.9
45,The Lion King,"Lion prince Simba and his father are targeted by his bitter uncle, who wants to ascend the throne himself.",Animation,1994,88,8.5,88        ,1066875,422.78
46,The Usual Suspects,"A sole survivor tells of the twisty events leading up to a horrific gun battle on a boat, which began when five criminals met at a seemingly random police lineup.",Crime,1995,106,8.5,77        ,1091829,23.34
47,American History X,A former neo-nazi skinhead tries to prevent his younger brother from going down the same wrong path that he did.,Crime,1998,119,8.5,62        ,1129506,6.72
48,The Pianist,A Polish Jewish musician struggles to survive the destruction of the Warsaw ghetto of World War II.,Biography,2002,150,8.5,85        ,839812,32.57
49,Casablanca,A cynical expatriate American cafe owner struggles to decide whether or not to help his former lover and her fugitive husband escape the Nazis in French Morocco.,Drama,1942,102,8.5,100        ,575774,1.02
50,The Intouchables,"After he becomes a quadriplegic from a paragliding accident, an aristocrat hires a young man from the projects to be his caregiver.",Biography,2011,112,8.5,57        ,866379,13.18
51,Psycho,"A Phoenix secretary embezzles $40,000 from her employer's client, goes on the run and checks into a remote motel run by a young man under the domination of his mother.",Horror,1960,109,8.5,97        ,676977,32.0
52,Once Upon a Time in the West,A mysterious stranger with a harmonica joins forces with a notorious desperado to protect a beautiful widow from a ruthless assassin working for the railroad.,Western            ,1968,165,8.5,80        ,332682,5.32
53,Hotaru no haka,A young boy and his little sister struggle to survive in Japan during World War II.,Animation,1988,89,8.5,94        ,280960,
54,Rear Window,"A wheelchair-bound photographer spies on his neighbors from his Greenwich Village courtyard apartment window, and becomes convinced one of them has committed murder, despite the skepticism of his fashion-model girlfriend.",Mystery,1954,112,8.5,100        ,495471,36.76
55,Nuovo Cinema Paradiso,A filmmaker recalls his childhood when falling in love with the pictures at the cinema of his home village and forms a deep friendship with the cinema's projectionist.,Drama,1988,155,8.5,80        ,263813,11.99
56,Kaithi,"Dilli, an ex-convict, endeavours to meet his daughter for the first time after leaving prison. However, his attempts are interrupted due to a drug raid planned by Inspector Bejoy.",Action,2019,145,8.5,0,34106,0.0
57,Modern Times,The Tramp struggles to live in modern industrial society with the help of a young homeless woman.,Comedy,1936,87,8.5,96        ,244851,0.16
58,City Lights,"With the aid of a wealthy erratic tippler, a dewy-eyed tramp who has fallen in love with a sightless flower girl accumulates money to be able to help her medically.",Comedy,1931,87,8.5,99        ,186318,0.02
59,96,Two high school sweethearts meet at a reunion after 22 years and reminisce about their past.,Drama,II) ,158,8.5,0,32250,0.0
60,Avengers: Endgame,"After the devastating events of Avengers: Infinity War (2018), the universe is in ruins. With the help of remaining allies, the Avengers assemble once more in order to reverse Thanos' actions and restore balance to the universe.",Action,2019,181,8.4,78        ,1146205,858.37
61,Joker,A mentally troubled stand-up comedian embarks on a downward spiral that leads to the creation of an iconic villain.,Crime,I) (,122,8.4,59        ,1307884,335.45
62,Raiders of the Lost Ark,"In 1936, archaeologist and adventurer Indiana Jones is hired by the U.S. government to find the Ark of the Covenant before the Nazis can obtain its awesome powers.",Action,1981,115,8.4,85        ,973313,248.16
63,Django Unchained,"With the help of a German bounty-hunter, a freed slave sets out to rescue his wife from a brutal plantation-owner in Mississippi.",Drama,2012,165,8.4,81        ,1568756,162.81
64,American Beauty,A sexually frustrated suburban father has a mid-life crisis after becoming infatuated with his daughter's best friend.,Drama            ,1999,122,8.4,84        ,1161018,130.1
65,Avengers: Infinity War,The Avengers and their allies must be willing to sacrifice all in an attempt to defeat the powerful Thanos before his blitz of devastation and ruin puts an end to the universe.,Action,2018,149,8.4,68        ,1093586,678.82
66,The Dark Knight Rises,"Eight years after the Joker's reign of chaos, Batman is coerced out of exile with the assistance of the mysterious Selina Kyle in order to defend Gotham City from the vicious guerrilla terrorist Bane.",Action,2012,164,8.4,78        ,1716460,448.14
67,Oldeuboi,"After being kidnapped and imprisoned for fifteen years, Oh Dae-Su is released, only to find that he must find his captor in five days.",Action,2003,101,8.4,77        ,585458,0.71
68,Spider-Man: Into the Spider-Verse,"Teen Miles Morales becomes the Spider-Man of his universe, and must join with five spider-powered individuals from other dimensions to stop a threat for all realities.",Animation,2018,117,8.4,87        ,540270,190.24
69,The Shining,"A family heads to an isolated hotel for the winter where a sinister presence influences the father into violence, while his psychic son sees horrific forebodings from both past and future.",Drama,1980,146,8.4,66        ,1031229,44.02
70,Memento,A man with short-term memory loss attempts to track down his wife's murderer.,Mystery,2000,113,8.4,81        ,1246849,25.54
71,Braveheart,Scottish warrior William Wallace leads his countrymen in a rebellion to free his homeland from the tyranny of King Edward I of England.,Biography,1995,178,8.4,68        ,1043891,75.6
72,Aliens,"Fifty-seven years after surviving an apocalyptic attack aboard her space vessel by merciless space creatures, Officer Ripley awakens from hyper-sleep and tries to warn anyone who will listen about the predators.",Action,1986,137,8.4,84        ,723232,85.16
73,Idi i smotri,"After finding an old rifle, a young boy joins the Soviet resistance movement against ruthless German forces and experiences the horrors of World War II.",Drama,1985,142,8.4,0,82315,
74,Amadeus,"The life, success and troubles of Wolfgang Amadeus Mozart, as told by Antonio Salieri, the contemporaneous composer who was deeply jealous of Mozart's talent and claimed to have murdered him.",Biography,1984,160,8.4,88        ,404522,51.97
75,Hamilton,"The real life of one of America's foremost founding fathers and first Secretary of the Treasury, Alexander Hamilton. Captured live on Broadway from the Richard Rodgers Theater with the original Broadway cast.",Biography,2020,160,8.4,89        ,97549,
76,Coco,"Aspiring musician Miguel, confronted with his family's ancestral ban on music, enters the Land of the Dead to find his great-great-grandfather, a legendary singer.",Animation,I) (,105,8.4,81        ,517420,209.73
77,WALL·E,"In the distant future, a small waste-collecting robot inadvertently embarks on a space journey that will ultimately decide the fate of mankind.",Animation,2008,98,8.4,95        ,1124574,223.81
78,Kimi no na wa.,"Two strangers find themselves linked in a bizarre way. When a connection forms, will distance be the only thing to keep them apart?",Animation,2016,106,8.4,79        ,274202,5.02
79,The Lives of Others,"In 1984 East Berlin, an agent of the secret police, conducting surveillance on a writer and his lover, finds himself becoming increasingly absorbed by their lives.",Drama,2006,137,8.4,89        ,392321,11.29
80,3 Idiots,"Two friends are searching for their long lost companion. They revisit their college days and recall the memories of their friend who inspired them to think differently, even as the rest of the world called them ""idiots"".",Comedy,2009,170,8.4,67        ,404341,6.53
81,Dr. Strangelove or: How I Learned to Stop Worrying and Love the Bomb,"An insane American general orders a bombing attack on the Soviet Union, triggering a path to nuclear holocaust that a war room full of politicians and generals frantically tries to stop.",Comedy,1964,95,8.4,97        ,494547,0.28
82,Capharnaüm,"While serving a five-year sentence for a violent crime, a 12-year-old boy sues his parents for neglect.",Drama            ,2018,126,8.4,75        ,92107,1.66
83,Mononoke-hime,"On a journey to find the cure for a Tatarigami's curse, Ashitaka finds himself in the middle of a war between the forest gods and Tatara, a mining colony. In this quest he also meets San, the Mononoke Hime.",Animation,1997,134,8.4,76        ,399103,2.38
84,Das Boot,A German U-boat stalks the frigid waters of the North Atlantic as its young crew experience the sheer terror and claustrophobic life of a submariner in World War II.,Drama,1981,149,8.4,86        ,252861,11.49
85,Sunset Blvd.,A screenwriter develops a dangerous relationship with a faded film star determined to make a triumphant return.,Drama,1950,110,8.4,0,223966,
86,Paths of Glory,"After refusing to attack an enemy position, a general accuses the soldiers of cowardice and their commanding officer must defend them.",Drama,1957,88,8.4,90        ,199356,
87,Witness for the Prosecution,A veteran British barrister must defend his client in a murder trial that has surprise after surprise.,Crime,1957,116,8.4,76        ,127126,8.18
88,The Great Dictator,Dictator Adenoid Hynkel tries to expand his empire while a poor Jewish barber tries to avoid persecution from Hynkel's regime.,Comedy,1940,125,8.4,0,225914,0.29
89,Tengoku to jigoku,An executive of a Yokohama shoe company becomes a victim of extortion when his chauffeur's son is kidnapped by mistake and held for ransom.,Crime,1963,143,8.4,90        ,46362,
90,Shershaah,"Shershaah is the story of PVC awardee Indian soldier Capt. Vikram Batra, whose bravery and unflinching courage in chasing the Pakistani soldiers out of Indian territory contributed immensely in India finally winning the Kargil War in 1999.",Action,2021,135,8.4,0,123131,0.0
91,Sardar Udham,A biopic detailing the 2 decades that Punjabi Sikh revolutionary Udham Singh spent planning the assassination of the man responsible for the Jallianwala Bagh massacre.,Biography,2021,164,8.4,0,43290,0.0
92,Drishyam 2,A gripping tale of an investigation and a family which is threatened by it. Will Georgekutty be able to protect his family this time?,Crime,2021,152,8.4,0,38386,0.0
93,Asuran,"The teenage son of a farmer from an underprivileged caste kills a rich, upper caste landlord. Will the farmer, a loving father and a pacifist by heart, be able to save his hot-blooded son is the rest of the story.",Action,2019,141,8.4,0,30423,0.0
94,Top Gun: Maverick,"After thirty years, Maverick is still pushing the envelope as a top naval aviator, but must confront ghosts of his past when he leads TOP GUN's elite graduates on a mission that demands the ultimate sacrifice from those chosen to fly it.",Action,2022,130,8.3,78        ,521234,
95,Good Will Hunting,"Will Hunting, a janitor at M.I.T., has a gift for mathematics, but needs help from a psychologist to find direction in his life.",Drama,1997,126,8.3,70        ,981994,138.43
96,Inglourious Basterds,"In Nazi-occupied France during World War II, a plan to assassinate Nazi leaders by a group of Jewish U.S. soldiers coincides with a theatre owner's vengeful plans for the same.",Adventure,2009,153,8.3,69        ,1463278,120.54
97,Heat,A group of high-end professional thieves start to feel the heat from the LAPD when they unknowingly leave a clue at their latest heist.,Action,1995,170,8.3,76        ,661776,67.44
98,Requiem for a Dream,The drug-induced utopias of four Coney Island people are shattered when their addictions run deep.,Drama            ,2000,102,8.3,71        ,849257,3.64
99,Eternal Sunshine of the Spotless Mind,"When their relationship turns sour, a couple undergoes a medical procedure to have each other erased from their memories for ever.",Drama,2004,108,8.3,89        ,1015945,34.4
100,Scarface,"In 1980 Miami, a determined Cuban immigrant takes over a drug cartel and succumbs to greed.",Crime,1983,170,8.3,65        ,849805,45.6
101,A Clockwork Orange,"In the future, a sadistic gang leader is imprisoned and volunteers for a conduct-aversion experiment, but it doesn't go as planned.",Crime,1971,136,8.3,77        ,836295,6.21
102,Reservoir Dogs,"When a simple jewelry heist goes horribly wrong, the surviving criminals begin to suspect that one of them is a police informant.",Crime,1992,99,8.3,79        ,1026870,2.83
103,Drishyam 2,A gripping tale of an investigation and a family which is threatened by it. Will Vijay Salgaonkar be able to protect his family this time?,Crime,2022,140,8.3,0,31042,0.0
104,2001: A Space Odyssey,"After uncovering a mysterious artifact buried beneath the Lunar surface, a spacecraft is sent to Jupiter to find its origins - a spacecraft manned by two men and the supercomputer H.A.L. 9000.",Adventure,1968,149,8.3,84        ,674732,56.95
105,Jagten,"A teacher lives a lonely life, all the while struggling over his son's custody. His life slowly gets better as he finds love and receives good news from his son, but his new luck is about to be brutally shattered by an innocent little lie.",Drama            ,2012,115,8.3,77        ,334655,0.69
106,Once Upon a Time in America,"A former Prohibition-era Jewish gangster returns to the Lower East Side of Manhattan 35 years later, where he must once again confront the ghosts and regrets of his old life.",Crime,1984,229,8.3,75        ,355264,5.32
107,Singin' in the Rain,A silent film star falls for a chorus girl just as he and his delusionally jealous screen partner are trying to make the difficult transition to talking pictures in 1920s Hollywood.,Comedy,1952,103,8.3,99        ,245358,8.82
108,Full Metal Jacket,A pragmatic U.S. Marine observes the dehumanizing effects the Vietnam War has on his fellow recruits from their brutal boot camp training to the bloody street fighting in Hue.,Drama,1987,116,8.3,76        ,748352,46.36
109,The Sting,Two grifters team up to pull off the ultimate con.,Comedy,1973,129,8.3,83        ,265536,159.6
110,Up,"78-year-old Carl Fredricksen travels to Paradise Falls in his house equipped with balloons, inadvertently taking a young stowaway.",Animation,2009,96,8.3,88        ,1052233,293.0
111,Kantara,It involves culture of Kambala and Bhootha Kola. A human and nature conflict where Shiva is a rebel who defends his village and nature. A death leads to war between villagers and evil forces. Will he be able to regain peace in the village?,Action,2022,148,8.3,0,90186,0.0
112,Toy Story,A cowboy doll is profoundly threatened and jealous when a new spaceman action figure supplants him as top toy in a boy's bedroom.,Animation,1995,81,8.3,96        ,1001629,191.8
113,Star Wars: Episode VI - Return of the Jedi,"After a daring mission to rescue Han Solo from Jabba the Hutt, the Rebels dispatch to Endor to destroy the second Death Star. Meanwhile, Luke struggles to help Darth Vader back from the dark side without falling into the Emperor's trap.",Action,1983,131,8.3,58        ,1061401,309.13
114,Lawrence of Arabia,"The story of T.E. Lawrence, the English officer who successfully united and led the diverse, often warring, Arab tribes during World War I in order to fight the Turks.",Adventure,1962,218,8.3,100        ,296706,44.82
