,Movie Name,Description,Genre,Year of Release,Watch Time,Movie Rating,Meatscore of movie,Votes,Gross (in M)
472,Avatar,A paraplegic Marine dispatched to the moon Pandora on a unique mission becomes torn between following his orders and protecting the world he feels is his home.,Action,2009,162,7.9,83        ,1320342,760.51
473,RRR (Rise Roar Revolt),A fictitious story about two legendary revolutionaries and their journey away from home before they started fighting for their country in the 1920s.,Action,2022,187,7.9,83        ,134506,0.0
474,Titanic,"A seventeen-year-old aristocrat falls in love with a kind but poor artist aboard the luxurious, ill-fated R.M.S. Titanic.",Drama,1997,194,7.9,75        ,1188276,659.33
475,In Bruges,"Guilt-stricken after a job gone wrong, hitman Ray and his partner await orders from their ruthless boss in Bruges, Belgium, the last place in the world Ray wants to be.",Comedy,2008,107,7.9,67        ,436420,7.76
476,Jojo Rabbit,A young German boy in the Hitler Youth whose hero and imaginary friend is the country's dictator is shocked to discover that his mother is hiding a Jewish girl in their home.,Comedy,2019,108,7.9,58        ,398402,33.37
477,Harry Potter and the Prisoner of Azkaban,"Harry Potter, Ron and Hermione return to Hogwarts School of Witchcraft and Wizardry for their third year of study, where they delve into the mystery surrounding an escaped prisoner who poses a dangerous threat to the young wizard.",Adventure,2004,142,7.9,82        ,643273,249.36
478,Shrek,"A mean lord exiles fairytale creatures to the swamp of a grumpy ogre, who must go on a quest and rescue a princess for the lord in order to get his land back.",Animation,2001,90,7.9,84        ,687009,267.67
479,Thor: Ragnarok,"Imprisoned on the planet Sakaar, Thor must race against time to return to Asgard and stop Ragnarök, the destruction of his world, at the hands of the powerful and ruthless villain Hela.",Action,2017,130,7.9,74        ,760988,315.06
480,Arrival,A linguist works with the military to communicate with alien lifeforms after twelve mysterious spacecrafts appear around the world.,Drama,II) ,116,7.9,81        ,704795,100.55
481,Mulholland Dr.,"After a car wreck on the winding Mulholland Drive renders a woman amnesiac, she and a perky Hollywood-hopeful search for clues and answers across Los Angeles in a twisting venture beyond dreams and reality.",Drama,2001,147,7.9,86        ,361399,7.22
482,Boogie Nights,"Back when sex was safe, pleasure was a business and business was booming, an idealistic porn producer aspires to elevate his craft to an art when he discovers a hot young talent.",Drama            ,1997,155,7.9,85        ,269402,26.4
483,Bohemian Rhapsody,"The story of the legendary British rock band Queen and lead singer Freddie Mercury, leading up to their famous performance at Live Aid (1985).",Biography,2018,134,7.9,49        ,545796,216.43
484,Iron Man,"After being held captive in an Afghan cave, billionaire engineer Tony Stark creates a unique weaponized suit of armor to fight evil.",Action,2008,126,7.9,79        ,1067244,318.41
485,Almost Famous,A high-school boy in the early 1970s is given the chance to write a story for Rolling Stone magazine about an up-and-coming rock band as he accompanies them on their concert tour.,Adventure,2000,122,7.9,90        ,280147,32.53
486,True Romance,"In Detroit, a lonely pop culture geek marries a call girl, steals cocaine from her pimp, and tries to sell it in Hollywood. Meanwhile, the owners of the cocaine, the Mob, track them down in an attempt to reclaim it.",Crime,1993,119,7.9,59        ,230112,12.28
487,Edge of Tomorrow,"A soldier fighting aliens gets to relive the same day over and over again, the day restarting every time he dies.",Action,2014,113,7.9,71        ,686799,100.21
488,The Perks of Being a Wallflower,An introvert freshman is taken under the wings of two seniors who welcome him to the real world.,Drama            ,2012,103,7.9,67        ,518835,17.74
489,E.T. the Extra-Terrestrial,A troubled child summons the courage to help a friendly alien escape from Earth and return to his home planet.,Adventure,1982,115,7.9,91        ,415257,435.11
490,Star Trek,The brash James T. Kirk tries to live up to his father's legacy with Mr. Spock keeping him in check as a vengeful Romulan from the future creates black holes to destroy the Federation one planet at a time.,Action,2009,127,7.9,82        ,606850,257.73
491,Children of Men,"In 2027, in a chaotic world in which women have somehow become infertile, a former activist agrees to help transport a miraculously pregnant woman to a sanctuary at sea.",Action,2006,109,7.9,84        ,505421,35.55
492,Mystic River,The lives of three men who were childhood friends are shattered when one of them has a family tragedy.,Crime,2003,138,7.9,84        ,461787,90.14
493,Wo hu cang long,A young Chinese warrior steals a sword from a famed swordsman and then escapes into a world of romantic adventure with a mysterious man in the frontier of the nation.,Action,2000,120,7.9,94        ,272069,128.08
494,A Christmas Story,"In the 1940s, a young boy named Ralphie Parker attempts to convince his parents, teacher, and Santa Claus that a Red Ryder Range 200 Shot BB gun really is the perfect Christmas gift.",Comedy,1983,93,7.9,77        ,160149,20.61
495,Marriage Story,Noah Baumbach's incisive and compassionate look at a marriage breaking up and a family staying together.,Drama,2019,137,7.9,94        ,316523,2.0
496,Wonder,"Based on the New York Times bestseller, this movie tells the incredibly inspiring and heartwarming story of August Pullman, a boy with facial differences who enters the fifth grade, attending a mainstream elementary school for the first time.",Drama,I) (,113,7.9,66        ,167383,132.42
497,Fantastic Mr. Fox,An urbane fox cannot resist returning to his farm raiding ways and then must help his community survive the farmers' retaliation.,Animation,2009,87,7.9,83        ,237852,21.0
498,The Bourne Identity,"A man is picked up by a fishing boat, bullet-riddled and suffering from amnesia, before racing to elude assassins and attempting to regain his memory.",Action,2002,119,7.9,68        ,552084,121.66
499,The Blues Brothers,"Jake Blues rejoins with his brother Elwood after being released from prison, but the duo has just days to reunite their old R&B band and save the Catholic home where the two were raised, outrunning the police as they tear through Chicago.",Action,1980,133,7.9,60        ,203383,57.23
500,Life of Pi,"A young man who survives a disaster at sea is hurtled into an epic journey of adventure and discovery. While cast away, he forms an unexpected connection with another survivor: a fearsome Bengal tiger.",Adventure,2012,127,7.9,79        ,637365,124.99
501,Sing Street,A boy growing up in Dublin during the 1980s escapes his strained family life by starting a band to impress the mysterious girl he likes.,Comedy,2016,106,7.9,79        ,96055,3.24
502,X-Men: Days of Future Past,The X-Men send Wolverine to the past in a desperate effort to change history and prevent an event that results in doom for both humans and mutants.,Action,2014,132,7.9,75        ,718027,233.92
503,Dallas Buyers Club,"In 1985 Dallas, electrician and hustler Ron Woodroof works around the system to help AIDS patients get the medication they need after he is diagnosed with the disease.",Biography,2013,117,7.9,77        ,493939,27.3
504,District 9,Violence ensues after an extraterrestrial race forced to live in slum-like conditions on Earth finds a kindred spirit in a government agent exposed to their biotechnology.,Action,2009,112,7.9,81        ,687897,115.65
505,The Wrestler,"A faded professional wrestler must retire, but finds his quest for a new life outside the ring a dispiriting struggle.",Drama,2008,109,7.9,80        ,309456,26.24
506,Shaun of the Dead,"The uneventful, aimless lives of a London electronics salesman and his layabout roommate are disrupted by the zombie apocalypse.",Comedy,2004,99,7.9,76        ,564110,13.54
507,Boyhood,"The life of Mason, from early childhood to his arrival at college.",Drama            ,I) (,165,7.9,100        ,357356,25.38
508,Edward Scissorhands,The solitary life of an artificial man - who was incompletely constructed and has scissors for hands - is upended when he is taken in by a suburban family.,Drama,1990,105,7.9,74        ,497342,56.36
509,This Is Spinal Tap,"Spinal Tap, one of England's loudest bands, is chronicled by film director Marty DiBergi on what proves to be a fateful tour.",Comedy,1984,82,7.9,92        ,141503,4.74
510,In the Heat of the Night,"A black Philadelphia police detective is mistakenly suspected of a local murder while passing through a racially hostile Mississippi town, and after being cleared is reluctantly asked by the police chief to investigate the case.",Drama,1967,110,7.9,76        ,78047,24.38
511,Brazil,A bureaucrat in a dystopic society becomes an enemy of the state as he pursues the woman of his dreams.,Drama,1985,132,7.9,84        ,203203,9.93
512,Toy Story 2,"When Woody is stolen by a toy collector, Buzz and his friends set out on a rescue mission to save Woody before he becomes a museum toy property with his roundup gang Jessie, Prospector, and Bullseye.",Animation,1999,92,7.9,88        ,587378,245.85
513,The Man from Earth,An impromptu goodbye party for Professor John Oldman becomes a mysterious interrogation after the retiring scholar reveals to his colleagues he has a longer and stranger past than they can imagine.,Drama,2007,87,7.9,0,190035,0.0
514,Mildred Pierce,A hard-working mother inches towards disaster as she divorces her husband and starts a successful restaurant business to support her spoiled daughter.,Crime,1945,111,7.9,88        ,26627,0.0
515,Before Midnight,We meet Jesse and Celine nine years on in Greece. Almost two decades have passed since their first meeting on that train bound for Vienna.,Drama,2013,109,7.9,94        ,161305,8.11
516,The Ten Commandments,"Moses, raised as a prince of Egypt in the Pharaoh's household, learns of his true heritage as a Hebrew and his divine mission as the deliverer of his people from slavery.",Adventure,1956,220,7.9,0,72161,93.74
517,Doctor Zhivago,"The life of a Russian physician and poet who, although married to another, falls in love with a political activist's wife and experiences hardship during World War I and then the October Revolution.",Drama,1965,197,7.9,69        ,78291,111.72
518,Bound by Honor,"Based on the true life experiences of poet Jimmy Santiago Baca, the film focuses on step-brothers Paco and Cruz, and their bi-racial cousin Miklo.",Crime,1993,180,7.9,47        ,32174,4.5
519,Låt den rätte komma in,"Oskar, an overlooked and bullied boy, finds love and revenge through Eli, a beautiful but peculiar girl.",Drama,2008,114,7.9,82        ,219916,2.12
520,Carlito's Way,"A Puerto Rican former convict, just released from prison, pledges to stay away from drugs and violence despite the pressure around him and lead on to a better life outside of N.Y.C.",Crime,1993,144,7.9,66        ,221495,36.95
521,Spartacus,"The slave Spartacus survives brutal training as a gladiator and leads a violent revolt against the decadent Roman Republic, as the ambitious Crassus seeks to gain power by crushing the uprising.",Adventure,1960,197,7.9,87        ,136746,30.0
522,The Nightmare Before Christmas,"Jack Skellington, king of Halloween Town, discovers Christmas Town, but his attempts to bring Christmas to his home causes confusion.",Animation,1993,76,7.9,82        ,347541,75.08
523,Kôkaku Kidôtai,A cyborg policewoman and her partner hunt a mysterious and powerful hacker called the Puppet Master.,Animation,1995,83,7.9,76        ,145803,0.52
524,Charade,Romance and suspense ensue in Paris as a woman is pursued by several men who want a fortune her murdered husband had stolen. Whom can she trust?,Comedy,1963,113,7.9,83        ,79657,13.47
525,A Streetcar Named Desire,Disturbed Blanche DuBois moves in with her sister in New Orleans and is tormented by her brutish brother-in-law while her reality crumbles around her.,Drama            ,1951,122,7.9,97        ,109782,8.0
526,All the President's Men,"""The Washington Post"" reporters Bob Woodward and Carl Bernstein uncover the details of the Watergate scandal that leads to President Richard Nixon's resignation.",Drama,1976,138,7.9,84        ,118006,70.6
527,Nosferatu,Vampire Count Orlok expresses interest in a new residence and real estate agent Hutter's wife.,Fantasy,1922,94,7.9,0,99381,0.0
528,The Searchers,An American Civil War veteran embarks on a years-long journey to rescue his niece from the Comanches after the rest of his brother's family is massacred in a raid on their Texas farm.,Adventure,1956,119,7.9,94        ,91124,0.0
529,Per un pugno di dollari,"A wandering gunfighter plays two rival families against each other in a town torn apart by greed, pride, and revenge.",Action,1964,99,7.9,65        ,220525,14.5
530,The Artist,An egomaniacal film star develops a relationship with a young dancer against the backdrop of Hollywood's silent era.,Comedy,I) (,100,7.9,89        ,243147,44.67
531,Harold and Maude,"Young, rich, and obsessed with death, Harold finds himself changed forever when he meets lively septuagenarian Maude at a funeral.",Comedy,1971,91,7.9,62        ,78687,0.0
532,Manbiki kazoku,A family of small-time crooks take in a child they find outside in the cold.,Crime,2018,121,7.9,93        ,78811,3.31
533,Serbuan maut 2: Berandal,"Only a short time after the first raid, Rama goes undercover with the thugs of Jakarta and plans to bring down the syndicate and uncover the corruption within his police force.",Action,2014,150,7.9,71        ,125276,2.63
534,The Wild Bunch,"An aging group of outlaws look for one last big score as the ""traditional"" American West is disappearing around them.",Action,1969,145,7.9,98        ,86039,12.06
535,Ying xiong,"A defense officer, Nameless, was summoned by the King of Qin regarding his success of terminating three warriors.",Action,2002,120,7.9,85        ,183080,53.71
536,My Name Is Khan,An Indian Muslim man with Asperger's syndrome takes a challenge to speak to the President of the United States seriously and embarks on a cross-country journey.,Adventure,2010,165,7.9,50        ,109300,4.02
537,Togo,"The story of Togo, the sled dog who led the 1925 serum run despite being considered too small and weak to lead such an intense race.",Adventure,2019,113,7.9,69        ,50618,0.0
538,Dancer in the Dark,An Eastern European US immigrant with a love for musicals has to cope with the gradual loss of her vision.,Crime,2000,140,7.9,61        ,111631,4.18
539,Trois couleurs: Bleu,A woman struggles to find a way to live her life after the death of her husband and child.,Drama,1993,94,7.9,85        ,104342,1.32
540,King Kong,A film crew goes to a tropical island for an exotic location shoot and discovers a colossal ape who takes a shine to their female blonde star. He is then captured and brought back to New York City for public exhibition.,Adventure,1933,100,7.9,90        ,86879,10.0
541,The Big Sleep,"Private detective Philip Marlowe is hired by a wealthy family. Before the complex case is over, he's seen murder, blackmail, and what might be love.",Crime,1946,114,7.9,86        ,86995,6.54
542,My Left Foot: The Story of Christy Brown,"Christy Brown, born with cerebral palsy, learns to paint and write with his only controllable limb - his left foot.",Biography,1989,103,7.9,97        ,75677,14.74
543,Amour,"Georges and Anne are an octogenarian couple. They are cultivated, retired music teachers. Their daughter, also a musician, lives in Britain with her family. One day, Anne has a stroke, and the couple's bond of love is severely tested.",Drama            ,2012,127,7.9,95        ,101847,6.74
544,Vivre sa vie: Film en douze tableaux,Twelve episodic tales in the life of a Parisian woman and her slow descent into prostitution.,Drama            ,1962,80,7.9,0,32924,0.0
545,Short Term 12,A 20-something supervising staff member of a residential treatment facility navigates the troubled waters of that world alongside her co-worker and longtime boyfriend.,Drama            ,2013,96,7.9,82        ,88902,1.01
546,Mimi wo sumaseba,"A love story between a girl who loves reading books, and a boy who has previously checked out all of the library books she chooses.",Animation,1995,111,7.9,75        ,64679,0.0
547,Letters from Iwo Jima,"The story of the battle of Iwo Jima between the United States and Imperial Japan during World War II, as told from the perspective of the Japanese who fought it.",Action,2006,141,7.9,89        ,164588,13.76
548,Rope,Two men attempt to prove they committed the perfect crime by hosting a dinner party after strangling their former classmate to death.,Crime,1948,80,7.9,73        ,145910,0.0
549,Arsenic and Old Lace,A Brooklyn writer of books on the futility of marriage risks his reputation when he decides to tie the knot. Things get even more complicated when he learns on his wedding day that his beloved maiden aunts are habitual murderers.,Comedy,1944,118,7.9,0,72048,0.0
550,The Philadelphia Story,"When a rich woman's ex-husband and a tabloid-type reporter turn up just before her planned remarriage, she begins to learn the truth about herself.",Comedy,1940,112,7.9,96        ,70532,0.0
551,The Manchurian Candidate,An American POW in the Korean War is brainwashed as an unwitting assassin for an international Communist conspiracy.,Drama,1962,126,7.9,94        ,76588,0.0
552,Patton,The World War II phase of the career of controversial American general George S. Patton.,Biography,1970,172,7.9,86        ,103592,61.7
553,Notorious,The daughter of a convicted Nazi spy is asked by American agents to gather information on a ring of Nazi scientists in South America. How far will she have to go to ingratiate herself with them?,Drama,1946,102,7.9,100        ,102594,10.46
554,Hable con ella,Two men share an odd friendship while they care for two women who are both in deep comas.,Drama,2002,112,7.9,86        ,113911,9.28
555,The Adventures of Robin Hood,"When Prince John and the Norman Lords begin oppressing the Saxon masses in King Richard's absence in 1190s England, a Saxon lord fights back as the outlaw leader of a resistance movement.",Action,1938,102,7.9,97        ,52066,3.98
556,Strangers on a Train,A psychopath forces a tennis star to comply with his theory that two strangers can get away with murder.,Crime,1951,101,7.9,88        ,135528,7.63
557,The Lion in Winter,"1183 A.D.: King Henry II's three sons all want to inherit the throne, but he won't commit to a choice. When he allows his imprisoned wife Eleanor of Aquitaine out for a Christmas visit, they all variously plot to force him into a decision.",Biography,1968,134,7.9,0,32171,22.28
558,Taeksi woonjunsa,"A widowed father and taxi driver who drives a German reporter from Seoul to Gwangju to cover the 1980 uprising, soon finds himself regretting his decision after being caught in the violence around him.",Action,2017,137,7.9,69        ,26078,1.53
559,Once Were Warriors,A family descended from Maori warriors is bedeviled by a violent father and the societal problems of being treated as outcasts.,Crime,1994,102,7.9,77        ,35034,2.2
560,The Thin Man,"Former detective Nick Charles and his wealthy wife Nora investigate a murder case, mostly for the fun of it.",Comedy,1934,91,7.9,86        ,30779,0.0
561,Harvey,"Due to his insistence that he has an invisible six foot-tall rabbit for a best friend, a whimsical middle-aged man is thought by his family to be insane - but he may be wiser than anyone knows.",Comedy,1950,104,7.9,0,56302,0.0
562,Il conformista,"A weak-willed Italian man becomes a fascist flunky who goes abroad to arrange the assassination of his old teacher, now a political dissident.",Drama            ,1970,113,7.9,100        ,31405,0.54
563,In Cold Blood,"Two ex-cons murder a family in a robbery attempt, before going on the run from the authorities. The police try to piece together the details of the murder in an attempt to track down the killers.",Biography,1967,134,7.9,89        ,27261,0.0
564,Kal Ho Naa Ho,"Naina, an introverted, perpetually depressed girl's life changes when she meets Aman. But Aman has a secret of his own which changes their lives forever. Embroiled in all this is Rohit, Naina's best friend who conceals his love for her.",Comedy,2003,186,7.9,54        ,70904,1.79
565,Gegen die Wand,"With the intention to break free from the strict familial restrictions, a suicidal young woman sets up a marriage of convenience with a forty-year-old addict, an act that will lead to an outburst of envious love.",Drama,2004,121,7.9,78        ,55251,0.0
566,Cat on a Hot Tin Roof,Brick is an alcoholic ex-football player who drinks his days away and resists the affections of his wife. A reunion with his terminal father jogs a host of memories and revelations for both father and son.,Drama            ,1958,108,7.9,84        ,50562,17.57
567,Laura,A police detective falls in love with the woman whose murder he is investigating.,Drama,1944,88,7.9,0,48420,4.36
568,Bin-jip,A transient young man breaks into empty homes to partake of the vacationing residents' lives for a few days.,Crime,2004,88,7.9,72        ,56013,0.24
569,"4 luni, 3 saptamâni si 2 zile",A woman assists her friend in arranging an illegal abortion in 1980s Romania.,Drama            ,2007,113,7.9,97        ,61200,1.19
570,Sacrifice,"At the dawn of World War III, a man searches for a way to restore peace to the world and finds he must give something in return.",Drama            ,1986,149,7.9,0,29057,0.3
571,Gully Boy,A coming-of-age story based on the lives of street rappers in Mumbai.,Drama,2019,154,7.9,65        ,40678,5.57
572,Amarcord,A series of comedic and nostalgic vignettes set in a 1930s Italian coastal town.,Comedy,1973,123,7.9,0,44466,0.58
573,Kagemusha,A petty thief with an utter resemblance to a samurai warlord is hired as the lord's double. When the warlord later dies the thief is forced to take up arms in his place.,Drama,1980,180,7.9,84        ,36320,0.0
574,C.R.A.Z.Y.,"A young French Canadian, one of five boys in a conservative family in the 1960s and 1970s, struggles to reconcile his emerging identity with his father's values.",Comedy,2005,129,7.9,81        ,33267,0.0
575,Super 30,Based on the life of Patna-based mathematician Anand Kumar who runs the famed Super 30 program for IIT aspirants in Patna.,Biography,2019,154,7.9,0,33089,2.27
576,Miracle on 34th Street,"After a divorced New York mother hires a nice old man to play Santa Claus at Macy's, she is startled by his claim to be the genuine article. When his sanity is questioned, a lawyer defends him in court by arguing that he's not mistaken.",Comedy,1947,96,7.9,88        ,50878,2.65
577,In a Lonely Place,"A potentially violent screenwriter is a murder suspect until his lovely neighbor clears him. However, she soon starts to have her doubts.",Drama,1950,94,7.9,0,32505,0.0
578,Nueve reinas,"Two con artists try to swindle a stamp collector by selling him a sheet of counterfeit rare stamps (the ""nine queens"").",Crime,2000,114,7.9,80        ,54031,1.22
579,Vozvrashchenie,"In the Russian wilderness, two brothers face a range of new, conflicting emotions when their father - a man they know only through a single photograph - resurfaces.",Drama            ,2003,110,7.9,82        ,46083,0.5
580,Jab We Met,A depressed wealthy businessman finds his life changing after he meets a spunky and care-free young woman.,Comedy,2007,138,7.9,0,54344,0.41
581,The Big Heat,Tough cop Dave Bannion takes on a politically powerful crime syndicate.,Crime,1953,89,7.9,0,27330,0.0
582,Le cercle rouge,"After leaving prison, master thief Corey crosses paths with a notorious escapee and an alcoholic former policeman. The trio proceed to plot an elaborate heist.",Crime,1970,140,7.9,91        ,26118,0.37
583,Hiroshima mon amour,A French actress filming an anti-war film in Hiroshima has an affair with a married Japanese architect as they share their differing perspectives on war.,Drama,1959,90,7.9,0,33236,0.09
584,Bronenosets Potemkin,"In the midst of the Russian Revolution of 1905, the crew of the battleship Potemkin mutiny against the brutal, tyrannical regime of the vessel's officers. The resulting street demonstration in Odessa brings on a police massacre.",Drama,1925,75,7.9,97        ,58806,0.05
585,Sullivan's Travels,Hollywood director John L. Sullivan sets out to experience life as a homeless person in order to gain relevant life experience for his next movie.,Adventure,1941,90,7.9,0,26992,0.0
586,Hoje Eu Quero Voltar Sozinho,"Leonardo is a blind teenager searching for independence. His everyday life, the relationship with his best friend, Giovana, and the way he sees the world change completely with the arrival of Gabriel.",Drama,2014,96,7.9,71        ,26047,0.1
587,Ascenseur pour l'échafaud,"A self-assured businessman murders his employer, the husband of his mistress, which unintentionally provokes an ill-fated chain of events.",Crime,1958,91,7.9,94        ,26530,0.11
588,No Man's Land,"Bosnia and Herzegovina during 1993 at the time of the heaviest fighting between the two warring sides. Two soldiers from opposing sides in the conflict, Nino and Ciki, become trapped in no man's land, whilst a third soldier becomes a living booby trap.",Comedy,I) (,98,7.9,84        ,47609,1.06
589,Darbareye Elly,The mysterious disappearance of a kindergarten teacher during a picnic in the north of Iran is followed by a series of misadventures for her fellow travelers.,Drama,2009,119,7.9,87        ,54351,0.11
590,The Lost Weekend,The desperate life of a chronic alcoholic is followed through a four-day drinking bout.,Drama,1945,101,7.9,0,37985,9.46
