,Movie Name,Description,Genre,Year of Release,Watch Time,Movie Rating,Meatscore of movie,Votes,Gross (in M)
705,Gaslight,"Ten years after her aunt was murdered in their London home, a woman returns from Italy in the 1880s to resume residence with her new husband. His obsessive interest in the home rises from a secret that may require driving his wife insane.",Crime,1944,114,7.8,78        ,30432,0.0
706,Madeo,A mother desperately searches for the killer who framed her son for a girl's horrific murder.,Crime,2009,129,7.8,79        ,66182,0.55
707,Breaking the Waves,"Oilman Jan is paralyzed in an accident. His wife, who prayed for his return, feels guilty; even more, when Jan urges her to have sex with another.",Drama            ,1996,159,7.8,79        ,68223,4.04
708,The Lady Vanishes,"While travelling in continental Europe, a rich young playgirl realizes that an elderly lady seems to have disappeared from the train.",Mystery,1938,96,7.8,98        ,53868,0.0
709,Chugyeokja,A disgraced ex-policeman who runs a small ring of prostitutes finds himself in a race against time when one of his women goes missing.,Action,2008,125,7.8,64        ,67977,0.0
710,The Day the Earth Stood Still,"An alien lands in Washington, D.C. and tells the people of Earth that they must live peacefully or be destroyed as a danger to other planets.",Drama,1951,92,7.8,0,82951,0.0
711,Frankenstein,Dr. Frankenstein dares to tamper with life and death by creating a human monster out of lifeless body parts.,Drama,1931,70,7.8,91        ,74714,0.0
712,Loving Vincent,"In a story depicted in oil painted animation, a young man comes to the last hometown of painter Vincent van Gogh to deliver the troubled artist's final letter and ends up investigating his final days there.",Animation,2017,94,7.8,62        ,59262,6.74
713,Days of Heaven,A hot-tempered farm laborer convinces the woman he loves to marry their rich but dying boss so that they can have a claim to his fortune.,Drama,1978,94,7.8,93        ,59264,0.0
714,Red River,"Dunson leads a cattle drive, the culmination of over 14 years of work, to its destination in Missouri. But his tyrannical behavior along the way causes a mutiny, led by his adopted son.",Drama,1948,133,7.8,0,32052,0.0
715,The World's Fastest Indian,"The story of New Zealander Burt Munro, who spent years rebuilding a 1920 Indian motorcycle, which helped him set the land speed world record at Utah's Bonneville Salt Flats in 1967.",Biography,2005,127,7.8,68        ,55885,5.13
716,Manhattan,The life of a divorced television writer dating a teenage girl is further complicated when he falls in love with his best friend's mistress.,Comedy,1979,96,7.8,83        ,141840,45.7
717,His Girl Friday,A newspaper editor uses every trick in the book to keep his ace reporter ex-wife from remarrying.,Comedy,1940,92,7.8,0,60001,0.3
718,Todo sobre mi madre,"Pedro Almodovar's Oscar-winning comedy (Best Foreign Film, 1999) about a bereaved mother, and overwrought actress, her jealous lover and a pregnant nun.",Drama            ,1999,101,7.8,87        ,98441,8.26
719,Shadow of a Doubt,"A teenage girl, overjoyed when her favorite uncle comes to visit the family in their quiet California town, slowly begins to suspect that he is in fact the ""Merry Widow"" killer sought by the authorities.",Film-Noir,1943,108,7.8,94        ,66779,0.0
720,The Man Who Would Be King,"Two former British soldiers in 1880s India decide to set themselves up as Kings in Kafiristan, a land where no white man has set foot since Alexander the Great.",Adventure,1975,129,7.8,91        ,49831,0.0
721,Das weiße Band - Eine deutsche Kindergeschichte,"Strange events happen in a small village in the north of Germany during the years before World War I, which seem to be ritual punishment. Who is responsible?",Drama,2009,144,7.8,82        ,74754,2.22
722,Batman: Mask of the Phantasm,Batman is wrongly implicated in a series of murders of mob bosses actually done by a new vigilante assassin.,Animation,1993,76,7.8,65        ,52521,5.62
723,"I, Daniel Blake","After surviving a heart-attack, a 59-year-old carpenter must fight bureaucratic forces to receive Employment and Support Allowance.",Drama            ,2016,100,7.8,78        ,61289,0.26
724,The Day of the Jackal,"In the aftermath of France allowing Algeria's independence, a group of resentful military veterans hire a professional assassin codenamed ""Jackal"" to kill President Charles de Gaulle.",Crime,1973,143,7.8,80        ,41922,16.06
725,Bringing Up Baby,"While trying to secure a $1 million donation for his museum, a befuddled paleontologist is pursued by a flighty and often irritating heiress and her pet leopard, Baby.",Comedy            ,1938,102,7.8,91        ,62794,0.0
726,Bride of Frankenstein,"Mary Shelley reveals the main characters of her novel survived: Dr. Frankenstein, goaded by an even madder scientist, builds his monster a mate.",Drama,1935,75,7.8,95        ,49895,4.36
727,"Aguirre, der Zorn Gottes","In the 16th century, the ruthless and insane Don Lope de Aguirre leads a Spanish expedition in search of El Dorado.",Action,1972,95,7.8,0,58291,0.0
728,Cowboy Bebop: Tengoku no tobira,"A terrorist explosion releases a deadly virus on the masses, and it's up to the bounty-hunting Bebop crew to catch the cold-blooded culprit.",Animation,2001,115,7.8,61        ,49914,1.0
729,Under sandet,"In post-World War II Denmark, a group of young German POWs are forced to clear a beach of thousands of land mines under the watch of a Danish Sergeant who slowly learns to appreciate their plight.",Drama,2015,100,7.8,75        ,42396,0.44
730,Un prophète,A young Algerian man is sent to a French prison.,Crime,2009,155,7.8,90        ,99524,2.08
731,Les parapluies de Cherbourg,A young woman separated from her lover by war faces a life-altering decision.,Drama,1964,91,7.8,86        ,28541,0.03
732,Le charme discret de la bourgeoisie,"A surreal, virtually plotless series of dreams centered around six middle-class people and their consistently interrupted attempts to have a meal together.",Comedy            ,1972,102,7.8,93        ,44076,0.2
733,Jûbê ninpûchô,A vagabond swordsman is aided by a beautiful ninja girl and a crafty spy in confronting a demonic clan of killers - with a ghost from his past as their leader - who are bent on overthrowing the Tokugawa Shogunate.,Animation,1993,94,7.8,0,38226,0.0
734,The Lunchbox,A mistaken delivery in Mumbai's famously efficient lunchbox delivery system connects a young housewife to an older man in the dusk of his life as they build a fantasy world together through notes in the lunchbox.,Drama,2013,104,7.8,76        ,57323,4.23
735,The Asphalt Jungle,"A major heist goes off as planned, but then double crosses, bad luck and solid police work cause everything to unravel.",Crime,1950,112,7.8,85        ,28015,0.0
736,Les choristes,The new teacher at a severely administered boys' boarding school works to positively affect the students' lives through music.,Comedy,2004,97,7.8,56        ,63649,3.64
737,L'avventura,"A woman disappears during a Mediterranean boating trip. During the search, her lover and her best friend become attracted to each other.",Drama,1960,144,7.8,0,30674,0.0
738,The Innocents,A young governess for two children becomes convinced that the house and grounds are haunted.,Horror            ,1961,100,7.8,88        ,31222,2.62
739,Soshite chichi ni naru,"Ryota is a successful workaholic businessman. When he learns that his biological son was switched with another boy after birth, he faces the difficult decision to choose his true son or the boy he and his wife have raised as their own.",Drama            ,2013,121,7.8,73        ,25811,0.28
740,You Can't Take It with You,"The son of a snobbish Wall Street banker becomes engaged to a woman from a good-natured but decidedly eccentric family, not realizing that his father is trying to force her family from their home for a real estate development.",Comedy,1938,126,7.8,0,26390,4.66
741,Bir Zamanlar Anadolu'da,A group of men set out in search of a dead body in the Anatolian steppes.,Crime,2011,157,7.8,82        ,47273,0.14
742,Crimes and Misdemeanors,An ophthalmologist's mistress threatens to reveal their affair to his wife while a married documentary filmmaker is infatuated with another woman.,Comedy,1989,104,7.8,77        ,58818,18.25
743,Dip huet seung hung,A disillusioned assassin accepts one last hit in hopes of using his earnings to restore vision to a singer he accidentally blinded.,Action,1989,111,7.8,82        ,49137,0.0
744,Il postino,"A simple Italian postman learns to love poetry while delivering mail to a famous poet, and then uses this to woo local beauty Beatrice.",Biography,1994,108,7.8,81        ,37188,21.85
745,Sennen joyû,A TV interviewer and his cameraman meet a former actress and travel through her memories and career.,Animation,2001,87,7.8,70        ,29023,0.19
746,Veer-Zaara,"""Veer-Zaara"" is a saga of love, separation, courage, and sacrifice. A love story that is an inspiration and will remain a legend forever.",Drama,2004,192,7.8,67        ,54234,2.92
747,Tôkyô goddofâzâzu,"On Christmas Eve, three homeless people living on the streets of Tokyo discover a newborn baby among the trash and set out to find its parents.",Animation,2003,92,7.8,73        ,42267,0.13
748,Duck Soup,"Rufus T. Firefly is named the dictator of bankrupt Freedonia and declares war on neighboring Sylvania over the love of his wealthy backer Mrs. Teasdale, contending with two inept spies who can't seem to keep straight which side they're on.",Comedy,1933,69,7.8,93        ,60797,0.0
749,Knockin' on Heaven's Door,"Two terminally ill patients escape from a hospital, steal a car and rush towards the sea.",Action,1997,87,7.8,0,31461,0.0
750,English Vinglish,"A quiet, sweet tempered housewife endures small slights from her well-educated husband and daughter every day because of her inability to speak and understand English.",Comedy,2012,134,7.8,0,37159,1.67
751,Hindi Medium,A couple from Chandni Chowk aspire to give their daughter the best education and thus be a part of and accepted by the elite of Delhi.,Comedy,2017,132,7.8,0,29921,0.0
752,A Night at the Opera,A sly business manager and the wacky friends of two opera singers in Italy help them achieve success in America while humiliating their stuffy and snobbish enemies.,Comedy,1935,96,7.8,0,33420,2.54
753,Vicky Donor,"A man is brought in by an infertility doctor to supply him with his sperm, where he becomes the biggest sperm donor for his clinic.",Comedy,2012,126,7.8,0,43979,0.17
754,The Fabelmans,"Growing up in post-World War II era Arizona, young Sammy Fabelman aspires to become a filmmaker as he reaches adolescence, but soon discovers a shattering family secret and explores how the power of films can help him see the truth.",Drama            ,2022,151,7.7,84        ,51550,0.0
755,Aftersun,Sophie reflects on the shared joy and private melancholy of a holiday she took with her father twenty years earlier. Memories real and imagined fill the gaps between as she tries to reconcile the father she knew with the man she didn't...,Drama            ,II) ,102,7.7,95        ,34272,0.0
756,Deliverance,"Intent on seeing the Cahulawassee River before it's dammed and turned into a lake, outdoor fanatic Lewis Medlock takes his friends on a canoeing trip they'll never forget into the dangerous American back-country.",Adventure,1972,109,7.7,80        ,112048,7.06
757,Get Out,"A young African-American visits his white girlfriend's parents for the weekend, where his simmering uneasiness about their reception of him eventually reaches a boiling point.",Horror,I) (,104,7.7,85        ,623580,176.04
758,Harry Potter and the Goblet of Fire,"Harry Potter finds himself competing in a hazardous tournament between rival schools of magic, but he is distracted by recurring nightmares.",Adventure,2005,157,7.7,81        ,635253,290.01
759,The Goonies,A group of young misfits called The Goonies discover an ancient map and set out on an adventure to find a legendary pirate's long-lost treasure.,Adventure,1985,114,7.7,62        ,279237,61.5
760,Birdman or (The Unexpected Virtue of Ignorance),"A washed-up superhero actor attempts to revive his fading career by writing, directing, and starring in a Broadway production.",Comedy,2014,119,7.7,87        ,636431,42.34
761,Mission: Impossible - Fallout,"Ethan Hunt and his IMF team, along with some familiar allies, race against time after a mission gone wrong.",Action,2018,147,7.7,86        ,337953,220.16
762,Ex Machina,A young programmer is selected to participate in a ground-breaking experiment in synthetic intelligence by evaluating the human qualities of a highly advanced humanoid A.I.,Drama,2014,108,7.7,78        ,552395,25.44
763,En man som heter Ove,"Ove, an ill-tempered, isolated retiree who spends his days enforcing block association rules and visiting his wife's grave, has finally given up on life just as an unlikely friendship develops with his boisterous new neighbors.",Comedy,2015,116,7.7,70        ,59485,3.36
764,Harry Potter and the Deathly Hallows: Part 1,"As Harry, Ron and Hermione race against time and evil to destroy the Horcruxes, they uncover the existence of the three most powerful objects in the wizarding world: the Deathly Hallows.",Adventure,2010,146,7.7,65        ,556980,295.98
765,The Hangover,"Three buddies wake up from a bachelor party in Las Vegas, with no memory of the previous night and the bachelor missing. They make their way around the city in order to find their friend before his wedding.",Comedy            ,2009,100,7.7,73        ,794270,277.32
766,Wind River,A veteran hunter helps an FBI agent investigate the murder of a young woman on a Wyoming Native American reservation.,Crime,2017,107,7.7,73        ,257306,33.8
767,Kingsman: The Secret Service,"A spy organisation recruits a promising street kid into the agency's training program, while a global threat emerges from a twisted tech genius.",Action,2014,129,7.7,60        ,674996,128.26
768,Primal Fear,"An altar boy is accused of murdering a priest, and the truth is buried several layers deep.",Crime,1996,129,7.7,47        ,225284,56.12
769,Zodiac,"Between 1968 and 1983, a San Francisco cartoonist becomes an amateur detective obsessed with tracking down the Zodiac Killer, an unidentified individual who terrorizes Northern California with a killing spree.",Crime,2007,157,7.7,79        ,550550,33.08
770,Brokeback Mountain,Ennis and Jack are two shepherds who develop a sexual and emotional relationship. Their relationship becomes complicated when both of them get married to their respective girlfriends.,Drama,2005,134,7.7,87        ,362532,83.04
771,Airplane!,A man afraid to fly must ensure that a plane lands safely after the pilots become sick.,Comedy            ,1980,88,7.7,78        ,244224,83.4
772,La vie d'Adèle,"Adèle's life is changed when she meets Emma, a young woman with blue hair, who will allow her to discover desire and to assert herself as a woman and as an adult. In front of others, Adèle grows, seeks herself, loses herself, and ultimately finds herself through love and loss.",Drama,2013,180,7.7,90        ,155024,2.2
773,Home Alone,"An eight-year-old troublemaker, mistakenly left home alone, must defend his home against a pair of burglars on Christmas eve.",Comedy,1990,103,7.7,63        ,597635,285.76
774,Road to Perdition,"A mob enforcer's son in 1930s Illinois witnesses a murder, forcing him and his father to take to the road, and his father down a path of redemption and revenge.",Crime,2002,117,7.7,72        ,272248,104.45
775,Deadpool 2,"Foul-mouthed mutant mercenary Wade Wilson (a.k.a. Deadpool) assembles a team of fellow mutant rogues to protect a young boy with supernatural abilities from the brutal, time-traveling cyborg Cable.",Action,2018,119,7.7,66        ,591001,324.59
776,Black Hawk Down,"The story of 160 elite U.S. soldiers who dropped into Mogadishu in October 1993 to capture two top lieutenants of a renegade warlord, but found themselves in a desperate battle with a large force of heavily armed Somalis.",Action,2001,144,7.7,74        ,401433,108.64
777,Silver Linings Playbook,"After a stint in a mental institution, former teacher Pat Solitano moves back in with his parents and tries to reconcile with his ex-wife. Things get more challenging when Pat meets Tiffany, a mysterious girl with problems of her own.",Comedy,2012,122,7.7,81        ,715085,132.09
778,Y tu mamá también,"In Mexico, two teenage boys and an attractive older woman embark on a road trip and learn a thing or two about life, friendship, sex, and each other.",Drama            ,2001,106,7.7,89        ,124596,13.62
779,Ocean's Eleven,Danny Ocean and his ten accomplices plan to rob three Las Vegas casinos simultaneously.,Crime,2001,116,7.7,74        ,582252,183.42
780,Training Day,A rookie cop spends his first day as a Los Angeles narcotics officer with a rogue detective who isn't what he appears to be.,Action,2001,122,7.7,69        ,442753,76.63
781,The Game,"After a wealthy San Francisco banker is given an opportunity to participate in a mysterious game, his life is turned upside down as he begins to question if it might really be a concealed conspiracy to destroy him.",Drama,1997,129,7.7,63        ,402696,48.32
782,Druk,Four high-school teachers consume alcohol on a daily basis to see how it affects their social and professional lives.,Comedy,2020,117,7.7,79        ,165703,0.0
783,A Few Good Men,Military lawyer Lieutenant Daniel Kaffee defends Marines accused of murder. They contend they were acting under orders.,Drama,1992,138,7.7,62        ,268826,141.34
784,Tangled,"The magically long-haired Rapunzel has spent her entire life in a tower, but now that a runaway thief has stumbled upon her, she is about to discover the world for the first time, and who she really is.",Animation,2010,100,7.7,71        ,460501,200.82
785,(500) Days of Summer,"After being dumped by the girl he believes to be his soulmate, hopeless romantic Tom Hansen reflects on their relationship to try and figure out where things went wrong and how he can win her back.",Comedy,2009,95,7.7,76        ,522792,32.39
786,The Color Purple,A black Southern woman struggles to find her identity after suffering abuse from her father and others over four decades.,Drama            ,1985,154,7.7,78        ,88710,98.47
787,Lost in Translation,A faded movie star and a neglected young woman form an unlikely bond after crossing paths in Tokyo.,Comedy,2003,102,7.7,91        ,460652,44.59
788,The Machinist,An industrial worker who hasn't slept in a year begins to doubt his own sanity.,Drama,2004,101,7.7,61        ,395657,1.08
789,Apollo 13,NASA must devise a strategy to return Apollo 13 to Earth safely after the spacecraft undergoes massive internal damage putting the lives of the three astronauts on board in jeopardy.,Adventure,I) (,140,7.7,77        ,299426,173.84
790,"O Brother, Where Art Thou?","In the deep south during the 1930s, three escaped convicts search for hidden treasure while a relentless lawman pursues them.",Adventure,2000,107,7.7,69        ,316629,45.51
791,Blue Velvet,"The discovery of a severed human ear found in a field leads a young man on an investigation related to a beautiful, mysterious nightclub singer and a group of psychopathic criminals who have kidnapped her child.",Crime,1986,120,7.7,76        ,202967,8.55
792,The Last of the Mohicans,Three trappers protect the daughters of a British Colonel in the midst of the French and Indian War.,Action,1992,112,7.7,76        ,174048,75.51
793,Empire of the Sun,A young English boy struggles to survive under Japanese occupation of China during World War II.,Drama,1987,153,7.7,62        ,128018,22.24
794,Argo,"Acting under the cover of a Hollywood producer scouting a location for a science fiction film, a CIA agent launches a dangerous operation to rescue six Americans in Tehran during the U.S. hostage crisis in Iran in 1979.",Biography,2012,120,7.7,86        ,619056,136.03
795,Gravity,Two astronauts work together to survive after an accident leaves them stranded in space.,Drama,2013,91,7.7,96        ,832788,274.09
796,First Blood,A veteran Green Beret is forced by a cruel Sheriff and his deputies to flee into the mountains and wage an escalating one-man war against his pursuers.,Action,1982,93,7.7,61        ,257657,47.21
797,The Boy in the Striped Pajamas,"Through the innocent eyes of Bruno, the eight-year-old son of the commandant at a German concentration camp, a forbidden friendship with a Jewish boy on the other side of the camp fence has startling and unexpected consequences.",Drama,2008,94,7.7,55        ,224045,9.03
798,The Lego Movie,"An ordinary LEGO construction worker, thought to be the prophesied as ""special"", is recruited to join a quest to stop an evil tyrant from gluing the LEGO universe into eternal stasis.",Animation,2014,100,7.7,83        ,360972,257.76
799,Blazing Saddles,"In order to ruin a western town, a corrupt politician appoints a black Sheriff, who promptly becomes his most formidable adversary.",Comedy,1974,93,7.7,73        ,142264,119.5
800,Sound of Metal,A heavy-metal drummer's life is thrown into freefall when he begins to lose his hearing.,Drama,2019,120,7.7,82        ,132064,0.0
801,The Count of Monte Cristo,"A young man, falsely imprisoned by his jealous ""friend"", escapes and uses a hidden treasure to exact his revenge.",Action,2002,131,7.7,61        ,140349,54.23
802,Lucky Number Slevin,"A case of mistaken identity lands Slevin into the middle of a war being plotted by two of the city's most rival crime bosses. Under constant surveillance by Detective Brikowski and assassin Goodkat, he must get them before they get him.",Crime,2006,110,7.7,53        ,316486,22.49
803,Detachment,A substitute teacher who drifts from classroom to classroom finds a connection to the students and teachers during his latest assignment.,Drama            ,2011,98,7.7,52        ,88188,0.07
804,What's Eating Gilbert Grape,A young man in a small Midwestern town struggles to care for his mentally-disabled younger brother and morbidly obese mother while attempting to pursue his own happiness.,Drama            ,1993,118,7.7,73        ,240879,9.17
805,Man on Fire,"In Mexico City, a former CIA operative swears vengeance on those who committed an unspeakable act against the family he was hired to protect.",Action,2004,146,7.7,47        ,367717,77.91
806,X: First Class,"In the 1960s, superpowered humans Charles Xavier and Erik Lensherr work together to find others like them, but Erik's vengeful pursuit of an ambitious mutant who ruined his life causes a schism to divide them.",Action,2011,131,7.7,65        ,698308,146.41
807,3:10 to Yuma,A small-time rancher agrees to hold a captured outlaw who's awaiting a train to go to court in Yuma. A battle of wills ensues as the outlaw tries to psych out the rancher.,Action,2007,122,7.7,76        ,316601,53.61
808,Midnight in Paris,"While on a trip to Paris with his fiancée's family, a nostalgic screenwriter finds himself mysteriously going back to the 1920s every day at midnight.",Comedy,2011,94,7.7,81        ,429347,56.82
809,Coraline,"An adventurous 11-year-old girl finds another world that is a strangely idealized version of her frustrating home, but it has sinister secrets.",Animation,2009,100,7.7,80        ,236358,75.29
810,Toy Story 4,"When a new toy called ""Forky"" joins Woody and the gang, a road trip alongside old and new friends reveals how big the world can be for a toy.",Animation,2019,100,7.7,84        ,255644,434.04
811,Goldfinger,"While investigating a gold magnate's smuggling, James Bond uncovers a plot to contaminate the Fort Knox gold reserve.",Action,1964,110,7.7,87        ,193330,51.08
812,The Fault in Our Stars,Two teenage cancer patients begin a life-affirming journey to visit a reclusive author in Amsterdam.,Drama,2014,126,7.7,69        ,381897,124.87
813,Clerks,"A day in the lives of two convenience clerks named Dante and Randal as they annoy customers, discuss movies, and play hockey on the store roof.",Comedy            ,1994,92,7.7,70        ,225481,3.15
814,Halloween,"Fifteen years after murdering his sister on Halloween night 1963, Michael Myers escapes from a mental hospital and returns to the small town of Haddonfield, Illinois to kill again.",Horror,1978,91,7.7,87        ,284766,47.0
815,Who Framed Roger Rabbit,A toon-hating detective is a cartoon rabbit's only hope to prove his innocence when he is accused of murder.,Animation,1988,104,7.7,83        ,204849,156.45
816,Sense and Sensibility,"Rich Mr. Dashwood dies, leaving his second wife and her three daughters poor by the rules of inheritance. The two eldest daughters are the title opposites.",Drama,1995,136,7.7,84        ,118339,43.18
817,As Good as It Gets,"A single mother and waitress, a misanthropic author, and a gay artist form an unlikely friendship after the artist is assaulted in a robbery.",Comedy,1997,139,7.7,67        ,302990,148.48
818,When Harry Met Sally...,"Harry and Sally have known each other for years, and are very good friends, but they fear sex would ruin the friendship.",Comedy,1989,95,7.7,76        ,225357,92.82
819,Flipped,Two eighth-graders start to have feelings for each other despite being total opposites.,Comedy,I) (,90,7.7,45        ,91896,1.75
820,Wreck-It Ralph,"A video game villain wants to be a hero and sets out to fulfill his dream, but his quest brings havoc to the whole arcade where he lives.",Animation,2012,101,7.7,72        ,428968,189.42
821,The Boondock Saints,Two Irish Catholic brothers become vigilantes and wipe out Boston's criminal underworld in the name of God.,Action,1999,108,7.7,44        ,241427,0.03
